{
  "host": "chen",
  "schemaVersion": 2,
  "updatedAt": "2026-10-21T20:00:10Z",
  "timezone": "UTC+8",
  "totals": {
    "cost": 21154.1173,
    "input": 870804336,
    "output": 75678018,
    "reasoning": 50117185,
    "cacheRead": 32681580098,
    "cacheWrite": 19257014,
    "tokens": 1015856553,
    "tokensInclCache": 33697436651,
    "conversations": 2580,
    "turns": 19649,
    "days": 104,
    "firstDate": "2026-03-03",
    "lastDate": "2026-10-22"
  },
  "unpricedModels": [
    "GLM-5.3",
    "deepseek-v4-flash-vision-exp",
    "glm-5.3-flash",
    "gpt-5.3-codex",
    "gpt-5.3-codex-spark",
    "gpt-5.4-mini",
    "gpt-5.6-luna",
    "gpt-6.1-sol",
    "gpt-6.1-sol-priority"
  ],
  "days": [
    {
      "date": "2026-03-03",
      "cost": 0,
      "input": 159808,
      "output": 25288,
      "reasoning": 9947,
      "cacheRead": 1935744,
      "cacheWrite": 0,
      "tokens": 195043,
      "tokensInclCache": 2130787,
      "conversations": 7,
      "turns": 21,
      "rows": [
        {
          "source": "codex",
          "model": "gpt-5.3-codex",
          "cost": 0,
          "input": 159808,
          "output": 25288,
          "reasoning": 9947,
          "cacheRead": 1935744,
          "cacheWrite": 0,
          "tokens": 195043,
          "tokensInclCache": 2130787
        }
      ]
    },
    {
      "date": "2026-03-04",
      "cost": 0,
      "input": 201628,
      "output": 8092,
      "reasoning": 3827,
      "cacheRead": 951552,
      "cacheWrite": 0,
      "tokens": 213547,
      "tokensInclCache": 1165099,
      "conversations": 5,
      "turns": 12,
      "rows": [
        {
          "source": "codex",
          "model": "gpt-5.3-codex",
          "cost": 0,
          "input": 201628,
          "output": 8092,
          "reasoning": 3827,
          "cacheRead": 951552,
          "cacheWrite": 0,
          "tokens": 213547,
          "tokensInclCache": 1165099
        }
      ]
    },
    {
      "date": "2026-03-05",
      "cost": 0,
      "input": 108289,
      "output": 3218,
      "reasoning": 3012,
      "cacheRead": 569088,
      "cacheWrite": 0,
      "tokens": 114519,
      "tokensInclCache": 683607,
      "conversations": 1,
      "turns": 4,
      "rows": [
        {
          "source": "codex",
          "model": "gpt-5.3-codex",
          "cost": 0,
          "input": 108289,
          "output": 3218,
          "reasoning": 3012,
          "cacheRead": 569088,
          "cacheWrite": 0,
          "tokens": 114519,
          "tokensInclCache": 683607
        }
      ]
    },
    {
      "date": "2026-03-06",
      "cost": 0.9212,
      "input": 196316,
      "output": 14389,
      "reasoning": 1440,
      "cacheRead": 1116800,
      "cacheWrite": 0,
      "tokens": 212145,
      "tokensInclCache": 1328945,
      "conversations": 3,
      "turns": 14,
      "rows": [
        {
          "source": "codex",
          "model": "gpt-5.4",
          "cost": 0.9212,
          "input": 179447,
          "output": 13236,
          "reasoning": 637,
          "cacheRead": 1057920,
          "cacheWrite": 0,
          "tokens": 193320,
          "tokensInclCache": 1251240
        },
        {
          "source": "codex",
          "model": "gpt-5.3-codex",
          "cost": 0,
          "input": 16869,
          "output": 1153,
          "reasoning": 803,
          "cacheRead": 58880,
          "cacheWrite": 0,
          "tokens": 18825,
          "tokensInclCache": 77705
        }
      ]
    },
    {
      "date": "2026-03-07",
      "cost": 1.7451,
      "input": 217749,
      "output": 25218,
      "reasoning": 6137,
      "cacheRead": 2921600,
      "cacheWrite": 0,
      "tokens": 249104,
      "tokensInclCache": 3170704,
      "conversations": 1,
      "turns": 10,
      "rows": [
        {
          "source": "codex",
          "model": "gpt-5.4",
          "cost": 1.7451,
          "input": 217749,
          "output": 25218,
          "reasoning": 6137,
          "cacheRead": 2921600,
          "cacheWrite": 0,
          "tokens": 249104,
          "tokensInclCache": 3170704
        }
      ]
    },
    {
      "date": "2026-03-08",
      "cost": 1.4637,
      "input": 189990,
      "output": 33728,
      "reasoning": 7493,
      "cacheRead": 1481472,
      "cacheWrite": 0,
      "tokens": 231211,
      "tokensInclCache": 1712683,
      "conversations": 5,
      "turns": 17,
      "rows": [
        {
          "source": "codex",
          "model": "gpt-5.4",
          "cost": 1.4637,
          "input": 189990,
          "output": 33728,
          "reasoning": 7493,
          "cacheRead": 1481472,
          "cacheWrite": 0,
          "tokens": 231211,
          "tokensInclCache": 1712683
        }
      ]
    },
    {
      "date": "2026-03-09",
      "cost": 4.0099,
      "input": 571875,
      "output": 53415,
      "reasoning": 8676,
      "cacheRead": 6595456,
      "cacheWrite": 0,
      "tokens": 633966,
      "tokensInclCache": 7229422,
      "conversations": 4,
      "turns": 19,
      "rows": [
        {
          "source": "codex",
          "model": "gpt-5.4",
          "cost": 4.0099,
          "input": 571875,
          "output": 53415,
          "reasoning": 8676,
          "cacheRead": 6595456,
          "cacheWrite": 0,
          "tokens": 633966,
          "tokensInclCache": 7229422
        }
      ]
    },
    {
      "date": "2026-03-10",
      "cost": 12.9271,
      "input": 1771383,
      "output": 105409,
      "reasoning": 60272,
      "cacheRead": 24053888,
      "cacheWrite": 0,
      "tokens": 1937064,
      "tokensInclCache": 25990952,
      "conversations": 8,
      "turns": 32,
      "rows": [
        {
          "source": "codex",
          "model": "gpt-5.4",
          "cost": 12.9271,
          "input": 1771383,
          "output": 105409,
          "reasoning": 60272,
          "cacheRead": 24053888,
          "cacheWrite": 0,
          "tokens": 1937064,
          "tokensInclCache": 25990952
        }
      ]
    },
    {
      "date": "2026-03-11",
      "cost": 3.8459,
      "input": 874660,
      "output": 31785,
      "reasoning": 3764,
      "cacheRead": 4504192,
      "cacheWrite": 0,
      "tokens": 910209,
      "tokensInclCache": 5414401,
      "conversations": 1,
      "turns": 13,
      "rows": [
        {
          "source": "codex",
          "model": "gpt-5.4",
          "cost": 3.8459,
          "input": 874660,
          "output": 31785,
          "reasoning": 3764,
          "cacheRead": 4504192,
          "cacheWrite": 0,
          "tokens": 910209,
          "tokensInclCache": 5414401
        }
      ]
    },
    {
      "date": "2026-03-12",
      "cost": 0.0523,
      "input": 6568,
      "output": 1258,
      "reasoning": 408,
      "cacheRead": 43392,
      "cacheWrite": 0,
      "tokens": 8234,
      "tokensInclCache": 51626,
      "conversations": 1,
      "turns": 2,
      "rows": [
        {
          "source": "codex",
          "model": "gpt-5.4",
          "cost": 0.0523,
          "input": 6568,
          "output": 1258,
          "reasoning": 408,
          "cacheRead": 43392,
          "cacheWrite": 0,
          "tokens": 8234,
          "tokensInclCache": 51626
        }
      ]
    },
    {
      "date": "2026-03-14",
      "cost": 0,
      "input": 0,
      "output": 0,
      "reasoning": 0,
      "cacheRead": 0,
      "cacheWrite": 0,
      "tokens": 0,
      "tokensInclCache": 0,
      "conversations": 1,
      "turns": 2,
      "rows": []
    },
    {
      "date": "2026-03-15",
      "cost": 3.2184,
      "input": 800093,
      "output": 28703,
      "reasoning": 3417,
      "cacheRead": 2945664,
      "cacheWrite": 0,
      "tokens": 832213,
      "tokensInclCache": 3777877,
      "conversations": 3,
      "turns": 17,
      "rows": [
        {
          "source": "codex",
          "model": "gpt-5.4",
          "cost": 3.2184,
          "input": 800093,
          "output": 28703,
          "reasoning": 3417,
          "cacheRead": 2945664,
          "cacheWrite": 0,
          "tokens": 832213,
          "tokensInclCache": 3777877
        }
      ]
    },
    {
      "date": "2026-03-16",
      "cost": 5.703,
      "input": 1258516,
      "output": 56186,
      "reasoning": 14787,
      "cacheRead": 5968640,
      "cacheWrite": 0,
      "tokens": 1329489,
      "tokensInclCache": 7298129,
      "conversations": 7,
      "turns": 39,
      "rows": [
        {
          "source": "codex",
          "model": "gpt-5.4",
          "cost": 5.703,
          "input": 1258516,
          "output": 56186,
          "reasoning": 14787,
          "cacheRead": 5968640,
          "cacheWrite": 0,
          "tokens": 1329489,
          "tokensInclCache": 7298129
        }
      ]
    },
    {
      "date": "2026-03-17",
      "cost": 7.781,
      "input": 1894759,
      "output": 48587,
      "reasoning": 20969,
      "cacheRead": 8003072,
      "cacheWrite": 0,
      "tokens": 1964315,
      "tokensInclCache": 9967387,
      "conversations": 5,
      "turns": 31,
      "rows": [
        {
          "source": "codex",
          "model": "gpt-5.4",
          "cost": 7.781,
          "input": 1894759,
          "output": 48587,
          "reasoning": 20969,
          "cacheRead": 8003072,
          "cacheWrite": 0,
          "tokens": 1964315,
          "tokensInclCache": 9967387
        }
      ]
    },
    {
      "date": "2026-03-18",
      "cost": 48.7879,
      "input": 9794247,
      "output": 262738,
      "reasoning": 221655,
      "cacheRead": 68145536,
      "cacheWrite": 0,
      "tokens": 10278640,
      "tokensInclCache": 78424176,
      "conversations": 6,
      "turns": 70,
      "rows": [
        {
          "source": "codex",
          "model": "gpt-5.4",
          "cost": 48.7879,
          "input": 9794247,
          "output": 262738,
          "reasoning": 221655,
          "cacheRead": 68145536,
          "cacheWrite": 0,
          "tokens": 10278640,
          "tokensInclCache": 78424176